[
  {
    "item_id": "currency_old_movie_ticket",
    "display_name": "Old Movie Ticket",
    "category": "Currency",
    "rarity": "Common",
    "stackable": true,
    "max_stack": 100,
    "weight": 0.01,
    "value_tickets": 1,
    "can_be_lost_on_death": true,
    "can_display_in_room": false,
    "display_location": null,
    "faction_restriction": null,
    "description": "A faded movie ticket accepted by most traders."
  },
  {
    "item_id": "consumable_almond_water",
    "display_name": "Almond Water",
    "category": "Consumable",
    "rarity": "Uncommon",
    "stackable": true,
    "max_stack": 10,
    "weight": 0.25,
    "value_tickets": 25,
    "can_be_lost_on_death": true,
    "can_display_in_room": false,
    "display_location": null,
    "faction_restriction": null,
    "description": "Restores sanity and supports survival in the Backrooms."
  },
  {
    "item_id": "item_flashlight",
    "display_name": "Flashlight",
    "category": "Tool",
    "rarity": "Common",
    "stackable": false,
    "max_stack": 1,
    "weight": 0.5,
    "value_tickets": 50,
    "can_be_lost_on_death": true,
    "can_display_in_room": false,
    "display_location": null,
    "faction_restriction": null,
    "description": "Basic light source."
  },
  {
    "item_id": "tool_meg_entity_scanner",
    "display_name": "M.E.G. Entity Scanner",
    "category": "FactionTool",
    "rarity": "Quest",
    "stackable": false,
    "max_stack": 1,
    "weight": 1.5,
    "value_tickets": 0,
    "can_be_lost_on_death": false,
    "can_display_in_room": true,
    "display_location": "Desk",
    "faction_restriction": "meg",
    "description": "Starter scanner used to detect nearby entity activity."
  },
  {
    "item_id": "tool_bntg_crowbar",
    "display_name": "B.N.T.G. Crowbar",
    "category": "FactionTool",
    "rarity": "Quest",
    "stackable": false,
    "max_stack": 1,
    "weight": 2.0,
    "value_tickets": 0,
    "can_be_lost_on_death": false,
    "can_display_in_room": true,
    "display_location": "WallRack",
    "faction_restriction": "bntg",
    "description": "Starter salvage tool for crates, doors, and scrap."
  },
  {
    "item_id": "tool_clippers_camcorder",
    "display_name": "Clippers Camcorder",
    "category": "FactionTool",
    "rarity": "Quest",
    "stackable": false,
    "max_stack": 1,
    "weight": 1.0,
    "value_tickets": 0,
    "can_be_lost_on_death": false,
    "can_display_in_room": true,
    "display_location": "TapeShelf",
    "faction_restriction": "clippers",
    "description": "Starter camcorder used to capture route evidence and reveal hidden clues."
  },
  {
    "item_id": "item_chalk_bundle",
    "display_name": "Chalk Bundle",
    "category": "Tool",
    "rarity": "Common",
    "stackable": true,
    "max_stack": 10,
    "weight": 0.05,
    "value_tickets": 5,
    "can_be_lost_on_death": true,
    "can_display_in_room": false,
    "display_location": null,
    "faction_restriction": null,
    "description": "Used by Clippers to mark routes."
  },
  {
    "item_id": "item_battery_pack",
    "display_name": "Battery Pack",
    "category": "Resource",
    "rarity": "Common",
    "stackable": true,
    "max_stack": 20,
    "weight": 0.1,
    "value_tickets": 8,
    "can_be_lost_on_death": true,
    "can_display_in_room": false,
    "display_location": null,
    "faction_restriction": null,
    "description": "Basic power source for prototype tools and lights."
  },
  {
    "item_id": "item_scrap_metal",
    "display_name": "Scrap Metal",
    "category": "Resource",
    "rarity": "Common",
    "stackable": true,
    "max_stack": 50,
    "weight": 0.2,
    "value_tickets": 3,
    "can_be_lost_on_death": true,
    "can_display_in_room": false,
    "display_location": null,
    "faction_restriction": null,
    "description": "Bulk salvage used for hub projects and trade."
  },
  {
    "item_id": "relic_golden_admit_one_ticket",
    "display_name": "Golden Admit-One Ticket",
    "category": "Relic",
    "rarity": "RelicClass",
    "stackable": false,
    "max_stack": 1,
    "weight": 0.01,
    "value_tickets": 10000,
    "can_be_lost_on_death": true,
    "can_display_in_room": true,
    "display_location": "GlassCase",
    "faction_restriction": null,
    "description": "A pristine gold ticket stamped with an unreadable theater name."
  }
]
